{
  "$schema": "https://raw.githubusercontent.com/pevyhlas/agentgraphicdesign/v0.1.0/schemas/agd-document.schema.json",
  "version": 1,
  "id": "0c5e0004-0000-4000-8000-000000000000",
  "name": "translucent-edge",
  "revn": 1,
  "canvas": { "width": 100, "height": 100 },
  "root": {
    "type": "frame",
    "id": "0c5e0004-0000-4000-8000-0000000000f0",
    "order": "a0",
    "name": "root",
    "width": 100,
    "height": 100,
    "children": [
      { "type": "ellipse", "id": "0c5e0004-0000-4000-8000-000000000001", "order": "a0", "name": "disc", "width": 70, "height": 70, "transform": { "x": 15, "y": 15 }, "style": { "fill": { "color": "#2563eb" }, "opacity": 0.5 } },
      { "type": "rectangle", "id": "0c5e0004-0000-4000-8000-000000000002", "order": "a1", "name": "tilted", "width": 40, "height": 20, "transform": { "x": 40, "y": 30, "rotation": 30 }, "style": { "fill": { "color": "#f59e0b" }, "opacity": 0.75 } }
    ]
  }
}
