{
  "$schema": "https://raw.githubusercontent.com/pevyhlas/agentgraphicdesign/v0.1.0/schemas/agd-document.schema.json",
  "version": 1,
  "id": "0c5e0001-0000-4000-8000-000000000000",
  "name": "square",
  "revn": 1,
  "canvas": { "width": 100, "height": 100, "background": "#ffffff" },
  "root": {
    "type": "frame",
    "id": "0c5e0001-0000-4000-8000-0000000000f0",
    "order": "a0",
    "name": "root",
    "width": 100,
    "height": 100,
    "children": [
      { "type": "rectangle", "id": "0c5e0001-0000-4000-8000-000000000001", "order": "a0", "name": "red", "width": 60, "height": 60, "transform": { "x": 20, "y": 20 }, "style": { "fill": { "color": "#dc2626" } } },
      { "type": "ellipse", "id": "0c5e0001-0000-4000-8000-000000000002", "order": "a1", "name": "blue", "width": 40, "height": 40, "transform": { "x": 50, "y": 50 }, "style": { "fill": { "color": "#1d4ed8" } } }
    ]
  }
}
