{
  "version": 1,
  "id": "00000000-0000-0000-0000-000000000600",
  "name": "ic-orbit",
  "revn": 1,
  "canvas": { "width": 32, "height": 32 },
  "root": {
    "type": "frame",
    "id": "00000000-0000-0000-0000-000000000601",
    "name": "root",
    "order": "a0",
    "width": 32,
    "height": 32,
    "clipContent": true,
    "children": [
      {
        "type": "path",
        "id": "00000000-0000-0000-0000-000000000602",
        "name": "ring",
        "order": "a0",
        "d": "M16 3 A13 13 0 1 1 16 29 A13 13 0 1 1 16 3 Z M16 8 A8 8 0 1 1 16 24 A8 8 0 1 1 16 8 Z",
        "style": { "fill": { "color": "#000000" }, "fillRule": "evenodd" }
      }
    ]
  }
}
