{
  "$schema": "https://raw.githubusercontent.com/pevyhlas/agentgraphicdesign/v0.1.0/schemas/agd-document.schema.json",
  "version": 1,
  "id": "00000000-0000-0000-0000-000000000001",
  "name": "basic-shapes",
  "revn": 1,
  "canvas": {
    "width": 800,
    "height": 600,
    "background": "#f0f0f0"
  },
  "root": {
    "type": "frame",
    "id": "00000000-0000-0000-0000-000000000002",
    "order": "a0",
    "name": "root",
    "width": 800,
    "height": 600,
    "clipContent": true,
    "visible": true,
    "locked": false,
    "children": [
      {
        "type": "rectangle",
        "id": "00000000-0000-0000-0000-000000000003",
        "order": "a0",
        "name": "red-square",
        "width": 100,
        "height": 100,
        "cornerRadius": 8,
        "visible": true,
        "locked": false,
        "transform": {
          "x": 50,
          "y": 50,
          "rotation": 0,
          "scaleX": 1,
          "scaleY": 1
        },
        "style": {
          "fill": {
            "color": "#ff0000"
          },
          "opacity": 1
        }
      },
      {
        "type": "ellipse",
        "id": "00000000-0000-0000-0000-000000000004",
        "order": "a1",
        "name": "blue-circle",
        "width": 80,
        "height": 80,
        "visible": true,
        "locked": false,
        "transform": {
          "x": 200,
          "y": 50,
          "rotation": 0,
          "scaleX": 1,
          "scaleY": 1
        },
        "style": {
          "fill": {
            "color": "#0000ff"
          },
          "stroke": {
            "color": "#000000",
            "width": 2
          },
          "opacity": 1
        }
      },
      {
        "type": "text",
        "id": "00000000-0000-0000-0000-000000000005",
        "order": "a2",
        "name": "title",
        "text": "Hello, World!",
        "fontFamily": "Arial",
        "fontSize": 24,
        "fontWeight": 700,
        "visible": true,
        "locked": false,
        "transform": {
          "x": 50,
          "y": 200,
          "rotation": 0,
          "scaleX": 1,
          "scaleY": 1
        },
        "style": {
          "fill": {
            "color": "#333333"
          },
          "opacity": 1
        }
      }
    ]
  }
}
