{
  "version": 1,
  "id": "30000000-0000-0000-0000-000000000001",
  "name": "valid-token-alias",
  "revn": 1,
  "canvas": {
    "width": 100,
    "height": 100
  },
  "tokens": {
    "colors": {
      "primary": "#336699",
      "accent": "{primary}"
    }
  },
  "root": {
    "type": "frame",
    "id": "30000000-0000-0000-0000-000000000002",
    "children": []
  }
}
